{
  "schemaVersion": "audit/v1",
  "profile": {
    "root": "<fixture>",
    "languages": [
      "javascript"
    ],
    "packageManagers": [
      "npm"
    ],
    "testFrameworks": [
      "ava"
    ],
    "architectures": [],
    "testCommand": "npm run test",
    "detectedConventions": [],
    "existingTestLocations": [
      "test/"
    ],
    "setupSignals": [
      "ava config"
    ],
    "confidence": "high",
    "blockers": []
  },
  "untestedCandidates": [
    {
      "id": "src/cartClient.js",
      "name": "cartClient",
      "path": "src/cartClient.js",
      "kind": "service",
      "signals": [
        "service-name",
        "external-boundary",
        "auth-branch"
      ],
      "risk": "high",
      "testability": "medium",
      "recommendedTestLevel": "unit",
      "riskReductionScore": 8,
      "maintenanceCost": 4,
      "reasons": [
        "Service boundary",
        "external dependency boundary",
        "auth or permission branches"
      ],
      "existingTestPaths": []
    }
  ],
  "coveredButRisky": [
    {
      "id": "src/cartParser.js",
      "name": "cartParser",
      "path": "src/cartParser.js",
      "kind": "pure-logic",
      "signals": [
        "pure-logic",
        "edge-case-surface",
        "matching-test"
      ],
      "risk": "high",
      "testability": "high",
      "recommendedTestLevel": "unit",
      "riskReductionScore": 9,
      "maintenanceCost": 2,
      "reasons": [
        "Pure transformation logic",
        "edge-case surface",
        "Existing test file detected; review missing edge cases"
      ],
      "existingTestPaths": [
        "test/cart-parser.js"
      ],
      "existingTestEvidence": [
        {
          "testPath": "test/cart-parser.js",
          "kind": "direct-relative-import",
          "strength": "direct",
          "usage": "asserted"
        }
      ]
    }
  ],
  "recommended": [
    {
      "id": "src/cartClient.js",
      "name": "cartClient",
      "path": "src/cartClient.js",
      "kind": "service",
      "signals": [
        "service-name",
        "external-boundary",
        "auth-branch"
      ],
      "risk": "high",
      "testability": "medium",
      "recommendedTestLevel": "unit",
      "riskReductionScore": 8,
      "maintenanceCost": 4,
      "reasons": [
        "Service boundary",
        "external dependency boundary",
        "auth or permission branches"
      ],
      "existingTestPaths": []
    },
    {
      "id": "src/cartParser.js",
      "name": "cartParser",
      "path": "src/cartParser.js",
      "kind": "pure-logic",
      "signals": [
        "pure-logic",
        "edge-case-surface",
        "matching-test"
      ],
      "risk": "high",
      "testability": "high",
      "recommendedTestLevel": "unit",
      "riskReductionScore": 9,
      "maintenanceCost": 2,
      "reasons": [
        "Pure transformation logic",
        "edge-case surface",
        "Existing test file detected; review missing edge cases"
      ],
      "existingTestPaths": [
        "test/cart-parser.js"
      ],
      "existingTestEvidence": [
        {
          "testPath": "test/cart-parser.js",
          "kind": "direct-relative-import",
          "strength": "direct",
          "usage": "asserted"
        }
      ]
    }
  ],
  "skipped": [
    {
      "id": "src/constants.js",
      "name": "constants",
      "path": "src/constants.js",
      "kind": "constants",
      "signals": [
        "constants-only"
      ],
      "riskReductionScore": 1,
      "maintenanceCost": 3,
      "reason": "Constants-only files are better covered by behavior that consumes the constants.",
      "preferredCoveragePath": "Cover through tests for the service, parser, or component that uses these constants."
    }
  ],
  "risks": [
    "cartClient has service boundary, external dependency boundary, auth or permission branches and has no matching test file.",
    "cartParser has pure transformation logic, edge-case surface and needs edge-case review."
  ]
}
