{
  "schemaVersion": "audit/v1",
  "profile": {
    "root": "<fixture>",
    "languages": [
      "java"
    ],
    "packageManagers": [
      "maven"
    ],
    "testFrameworks": [
      "junit"
    ],
    "architectures": [
      "jvm"
    ],
    "testCommand": "mvn test",
    "detectedConventions": [
      "*Test files",
      "src/test/java"
    ],
    "existingTestLocations": [
      "src/test"
    ],
    "setupSignals": [
      "maven"
    ],
    "confidence": "high",
    "blockers": []
  },
  "untestedCandidates": [
    {
      "id": "src/main/java/com/example/invoice/MoneyFormatter.java",
      "name": "MoneyFormatter",
      "path": "src/main/java/com/example/invoice/MoneyFormatter.java",
      "kind": "pure-logic",
      "signals": [
        "pure-logic",
        "edge-case-surface"
      ],
      "risk": "high",
      "testability": "high",
      "recommendedTestLevel": "unit",
      "riskReductionScore": 9,
      "maintenanceCost": 2,
      "reasons": [
        "Pure transformation logic",
        "edge-case surface"
      ],
      "existingTestPaths": []
    }
  ],
  "coveredButRisky": [
    {
      "id": "src/main/java/com/example/invoice/InvoiceValidator.java",
      "name": "InvoiceValidator",
      "path": "src/main/java/com/example/invoice/InvoiceValidator.java",
      "kind": "pure-logic",
      "signals": [
        "pure-logic",
        "edge-case-surface",
        "matching-test"
      ],
      "risk": "high",
      "testability": "high",
      "recommendedTestLevel": "unit",
      "riskReductionScore": 9,
      "maintenanceCost": 2,
      "reasons": [
        "Pure transformation logic",
        "edge-case surface",
        "Existing test file detected; review missing edge cases"
      ],
      "existingTestPaths": [
        "src/test/java/com/example/invoice/InvoiceValidatorTest.java"
      ]
    }
  ],
  "recommended": [
    {
      "id": "src/main/java/com/example/invoice/InvoiceValidator.java",
      "name": "InvoiceValidator",
      "path": "src/main/java/com/example/invoice/InvoiceValidator.java",
      "kind": "pure-logic",
      "signals": [
        "pure-logic",
        "edge-case-surface",
        "matching-test"
      ],
      "risk": "high",
      "testability": "high",
      "recommendedTestLevel": "unit",
      "riskReductionScore": 9,
      "maintenanceCost": 2,
      "reasons": [
        "Pure transformation logic",
        "edge-case surface",
        "Existing test file detected; review missing edge cases"
      ],
      "existingTestPaths": [
        "src/test/java/com/example/invoice/InvoiceValidatorTest.java"
      ]
    },
    {
      "id": "src/main/java/com/example/invoice/MoneyFormatter.java",
      "name": "MoneyFormatter",
      "path": "src/main/java/com/example/invoice/MoneyFormatter.java",
      "kind": "pure-logic",
      "signals": [
        "pure-logic",
        "edge-case-surface"
      ],
      "risk": "high",
      "testability": "high",
      "recommendedTestLevel": "unit",
      "riskReductionScore": 9,
      "maintenanceCost": 2,
      "reasons": [
        "Pure transformation logic",
        "edge-case surface"
      ],
      "existingTestPaths": []
    }
  ],
  "skipped": [
    {
      "id": "src/main/java/com/example/invoice/InvoiceRequest.java",
      "name": "InvoiceRequest",
      "path": "src/main/java/com/example/invoice/InvoiceRequest.java",
      "kind": "dto",
      "signals": [
        "dto-only"
      ],
      "riskReductionScore": 2,
      "maintenanceCost": 4,
      "reason": "DTO-only models are usually better covered through boundary parsing or mapper tests.",
      "preferredCoveragePath": "Cover through parser, mapper, repository, or route integration tests that consume the model."
    }
  ],
  "risks": [
    "InvoiceValidator has pure transformation logic, edge-case surface and needs edge-case review.",
    "MoneyFormatter has pure transformation logic, edge-case surface and has no matching test file."
  ]
}
