{
  "schemaVersion": "audit/v1",
  "profile": {
    "root": "<fixture>",
    "languages": [
      "swift"
    ],
    "packageManagers": [
      "bazel"
    ],
    "testFrameworks": [
      "XCTest"
    ],
    "architectures": [
      "bazel-swift",
      "concurrency"
    ],
    "testCommand": "bazel test //...",
    "detectedConventions": [
      "*Tests.swift files",
      "Bazel swift_test targets"
    ],
    "existingTestLocations": [
      "verification"
    ],
    "setupSignals": [
      "bazel swift rules",
      "bazel swift_test target"
    ],
    "confidence": "high",
    "blockers": []
  },
  "untestedCandidates": [
    {
      "id": "Core/PaymentClient.swift",
      "name": "PaymentClient",
      "path": "Core/PaymentClient.swift",
      "kind": "service",
      "signals": [
        "service-boundary",
        "async-or-concurrency"
      ],
      "risk": "high",
      "testability": "medium",
      "recommendedTestLevel": "unit",
      "riskReductionScore": 8,
      "maintenanceCost": 4,
      "reasons": [
        "Service boundary",
        "async or concurrency behavior"
      ],
      "existingTestPaths": []
    }
  ],
  "coveredButRisky": [
    {
      "id": "Core/CheckoutParser.swift",
      "name": "CheckoutParser",
      "path": "Core/CheckoutParser.swift",
      "kind": "pure-logic",
      "signals": [
        "pure-logic",
        "edge-case-surface",
        "matching-test"
      ],
      "risk": "high",
      "testability": "high",
      "recommendedTestLevel": "unit",
      "riskReductionScore": 9,
      "maintenanceCost": 2,
      "reasons": [
        "Pure transformation logic",
        "edge-case surface",
        "Existing test file detected; review missing edge cases"
      ],
      "existingTestPaths": [
        "verification/CheckoutParserTests.swift"
      ],
      "existingTestEvidence": [
        {
          "testPath": "verification/CheckoutParserTests.swift",
          "kind": "filename-convention",
          "strength": "naming"
        }
      ]
    }
  ],
  "recommended": [
    {
      "id": "Core/CheckoutParser.swift",
      "name": "CheckoutParser",
      "path": "Core/CheckoutParser.swift",
      "kind": "pure-logic",
      "signals": [
        "pure-logic",
        "edge-case-surface",
        "matching-test"
      ],
      "risk": "high",
      "testability": "high",
      "recommendedTestLevel": "unit",
      "riskReductionScore": 9,
      "maintenanceCost": 2,
      "reasons": [
        "Pure transformation logic",
        "edge-case surface",
        "Existing test file detected; review missing edge cases"
      ],
      "existingTestPaths": [
        "verification/CheckoutParserTests.swift"
      ],
      "existingTestEvidence": [
        {
          "testPath": "verification/CheckoutParserTests.swift",
          "kind": "filename-convention",
          "strength": "naming"
        }
      ]
    },
    {
      "id": "Core/PaymentClient.swift",
      "name": "PaymentClient",
      "path": "Core/PaymentClient.swift",
      "kind": "service",
      "signals": [
        "service-boundary",
        "async-or-concurrency"
      ],
      "risk": "high",
      "testability": "medium",
      "recommendedTestLevel": "unit",
      "riskReductionScore": 8,
      "maintenanceCost": 4,
      "reasons": [
        "Service boundary",
        "async or concurrency behavior"
      ],
      "existingTestPaths": []
    }
  ],
  "skipped": [],
  "risks": [
    "CheckoutParser has pure transformation logic, edge-case surface and needs edge-case review.",
    "PaymentClient has service boundary, async or concurrency behavior and has no matching test file."
  ]
}
