{
  "schemaVersion": "audit/v1",
  "profile": {
    "root": "<fixture>",
    "languages": [
      "swift"
    ],
    "packageManagers": [
      "swiftpm"
    ],
    "testFrameworks": [
      "Nimble",
      "Quick"
    ],
    "architectures": [
      "swift-package"
    ],
    "testCommand": "swift test",
    "detectedConventions": [
      "*Tests.swift files",
      "Tests"
    ],
    "existingTestLocations": [
      "Tests"
    ],
    "setupSignals": [
      "swift package manager",
      "quick test support",
      "nimble assertion support",
      "swiftpm test target",
      "swiftpm target"
    ],
    "confidence": "high",
    "blockers": []
  },
  "untestedCandidates": [
    {
      "id": "Sources/InventoryRules/StockFormatter.swift",
      "name": "StockFormatter",
      "path": "Sources/InventoryRules/StockFormatter.swift",
      "kind": "pure-logic",
      "signals": [
        "pure-logic",
        "edge-case-surface"
      ],
      "risk": "high",
      "testability": "high",
      "recommendedTestLevel": "unit",
      "riskReductionScore": 9,
      "maintenanceCost": 2,
      "reasons": [
        "Pure transformation logic",
        "edge-case surface"
      ],
      "existingTestPaths": []
    }
  ],
  "coveredButRisky": [
    {
      "id": "Sources/InventoryRules/StockValidator.swift",
      "name": "StockValidator",
      "path": "Sources/InventoryRules/StockValidator.swift",
      "kind": "pure-logic",
      "signals": [
        "pure-logic",
        "edge-case-surface",
        "matching-test"
      ],
      "risk": "high",
      "testability": "high",
      "recommendedTestLevel": "unit",
      "riskReductionScore": 9,
      "maintenanceCost": 2,
      "reasons": [
        "Pure transformation logic",
        "edge-case surface",
        "Existing test file detected; review missing edge cases"
      ],
      "existingTestPaths": [
        "Tests/InventoryRulesTests/StockValidatorTests.swift"
      ]
    }
  ],
  "recommended": [
    {
      "id": "Sources/InventoryRules/StockFormatter.swift",
      "name": "StockFormatter",
      "path": "Sources/InventoryRules/StockFormatter.swift",
      "kind": "pure-logic",
      "signals": [
        "pure-logic",
        "edge-case-surface"
      ],
      "risk": "high",
      "testability": "high",
      "recommendedTestLevel": "unit",
      "riskReductionScore": 9,
      "maintenanceCost": 2,
      "reasons": [
        "Pure transformation logic",
        "edge-case surface"
      ],
      "existingTestPaths": []
    },
    {
      "id": "Sources/InventoryRules/StockValidator.swift",
      "name": "StockValidator",
      "path": "Sources/InventoryRules/StockValidator.swift",
      "kind": "pure-logic",
      "signals": [
        "pure-logic",
        "edge-case-surface",
        "matching-test"
      ],
      "risk": "high",
      "testability": "high",
      "recommendedTestLevel": "unit",
      "riskReductionScore": 9,
      "maintenanceCost": 2,
      "reasons": [
        "Pure transformation logic",
        "edge-case surface",
        "Existing test file detected; review missing edge cases"
      ],
      "existingTestPaths": [
        "Tests/InventoryRulesTests/StockValidatorTests.swift"
      ]
    }
  ],
  "skipped": [
    {
      "id": "Sources/InventoryRules/StockResponseDTO.swift",
      "name": "StockResponseDTO",
      "path": "Sources/InventoryRules/StockResponseDTO.swift",
      "kind": "dto",
      "signals": [
        "dto-only"
      ],
      "riskReductionScore": 2,
      "maintenanceCost": 4,
      "reason": "DTO-only models are usually better covered through decoding, mapper, or boundary tests.",
      "preferredCoveragePath": "Cover through parser, mapper, networking, repository, or route integration tests that consume the model."
    }
  ],
  "risks": [
    "StockFormatter has pure transformation logic, edge-case surface and has no matching test file.",
    "StockValidator has pure transformation logic, edge-case surface and needs edge-case review."
  ]
}
