{
  "schemaVersion": "audit/v1",
  "profile": {
    "root": "<fixture>",
    "languages": [
      "typescript"
    ],
    "packageManagers": [
      "npm"
    ],
    "testFrameworks": [
      "node-test"
    ],
    "architectures": [],
    "testCommand": "npm run test",
    "detectedConventions": [
      "*.test files"
    ],
    "existingTestLocations": [
      "test/"
    ],
    "setupSignals": [
      "tsconfig"
    ],
    "confidence": "high",
    "blockers": []
  },
  "untestedCandidates": [
    {
      "id": "src/orderClient.ts",
      "name": "orderClient",
      "path": "src/orderClient.ts",
      "kind": "service",
      "signals": [
        "service-name",
        "external-boundary",
        "auth-branch"
      ],
      "risk": "high",
      "testability": "medium",
      "recommendedTestLevel": "unit",
      "riskReductionScore": 8,
      "maintenanceCost": 4,
      "reasons": [
        "Service boundary",
        "external dependency boundary",
        "auth or permission branches"
      ],
      "existingTestPaths": []
    }
  ],
  "coveredButRisky": [
    {
      "id": "src/orderParser.ts",
      "name": "orderParser",
      "path": "src/orderParser.ts",
      "kind": "pure-logic",
      "signals": [
        "pure-logic",
        "edge-case-surface",
        "matching-test"
      ],
      "risk": "high",
      "testability": "high",
      "recommendedTestLevel": "unit",
      "riskReductionScore": 9,
      "maintenanceCost": 2,
      "reasons": [
        "Pure transformation logic",
        "edge-case surface",
        "Existing test file detected; review missing edge cases"
      ],
      "existingTestPaths": [
        "test/orderParser.test.ts"
      ],
      "existingTestEvidence": [
        {
          "testPath": "test/orderParser.test.ts",
          "kind": "direct-relative-import",
          "strength": "direct",
          "usage": "asserted"
        }
      ]
    }
  ],
  "recommended": [
    {
      "id": "src/orderClient.ts",
      "name": "orderClient",
      "path": "src/orderClient.ts",
      "kind": "service",
      "signals": [
        "service-name",
        "external-boundary",
        "auth-branch"
      ],
      "risk": "high",
      "testability": "medium",
      "recommendedTestLevel": "unit",
      "riskReductionScore": 8,
      "maintenanceCost": 4,
      "reasons": [
        "Service boundary",
        "external dependency boundary",
        "auth or permission branches"
      ],
      "existingTestPaths": []
    },
    {
      "id": "src/orderParser.ts",
      "name": "orderParser",
      "path": "src/orderParser.ts",
      "kind": "pure-logic",
      "signals": [
        "pure-logic",
        "edge-case-surface",
        "matching-test"
      ],
      "risk": "high",
      "testability": "high",
      "recommendedTestLevel": "unit",
      "riskReductionScore": 9,
      "maintenanceCost": 2,
      "reasons": [
        "Pure transformation logic",
        "edge-case surface",
        "Existing test file detected; review missing edge cases"
      ],
      "existingTestPaths": [
        "test/orderParser.test.ts"
      ],
      "existingTestEvidence": [
        {
          "testPath": "test/orderParser.test.ts",
          "kind": "direct-relative-import",
          "strength": "direct",
          "usage": "asserted"
        }
      ]
    }
  ],
  "skipped": [
    {
      "id": "src/orderDto.ts",
      "name": "orderDto",
      "path": "src/orderDto.ts",
      "kind": "dto",
      "signals": [
        "dto-only"
      ],
      "riskReductionScore": 2,
      "maintenanceCost": 4,
      "reason": "DTO-only models are usually better covered through boundary parsing or mapper tests.",
      "preferredCoveragePath": "Cover through API/client parsing, mapper tests, or route integration tests."
    }
  ],
  "risks": [
    "orderClient has service boundary, external dependency boundary, auth or permission branches and has no matching test file.",
    "orderParser has pure transformation logic, edge-case surface and needs edge-case review."
  ]
}
