{
  "schemaVersion": "audit/v1",
  "profile": {
    "root": "<fixture>",
    "languages": [
      "swift"
    ],
    "packageManagers": [
      "swiftpm"
    ],
    "testFrameworks": [
      "XCTest"
    ],
    "architectures": [
      "concurrency",
      "swift-package",
      "swiftui"
    ],
    "testCommand": "swift test",
    "detectedConventions": [
      "*Tests.swift files",
      "Tests"
    ],
    "existingTestLocations": [
      "Tests"
    ],
    "setupSignals": [
      "swift package manager",
      "swiftpm test target",
      "swiftpm target"
    ],
    "confidence": "high",
    "blockers": []
  },
  "untestedCandidates": [
    {
      "id": "Sources/CheckoutCore/PaymentClient.swift",
      "name": "PaymentClient",
      "path": "Sources/CheckoutCore/PaymentClient.swift",
      "kind": "service",
      "signals": [
        "service-boundary",
        "async-or-concurrency"
      ],
      "risk": "high",
      "testability": "medium",
      "recommendedTestLevel": "unit",
      "riskReductionScore": 8,
      "maintenanceCost": 4,
      "reasons": [
        "Service boundary",
        "async or concurrency behavior"
      ],
      "existingTestPaths": []
    }
  ],
  "coveredButRisky": [
    {
      "id": "Sources/CheckoutCore/CheckoutParser.swift",
      "name": "CheckoutParser",
      "path": "Sources/CheckoutCore/CheckoutParser.swift",
      "kind": "pure-logic",
      "signals": [
        "pure-logic",
        "edge-case-surface",
        "matching-test"
      ],
      "risk": "high",
      "testability": "high",
      "recommendedTestLevel": "unit",
      "riskReductionScore": 9,
      "maintenanceCost": 2,
      "reasons": [
        "Pure transformation logic",
        "edge-case surface",
        "Existing test file detected; review missing edge cases"
      ],
      "existingTestPaths": [
        "Tests/CheckoutCoreTests/CheckoutParserTests.swift"
      ],
      "existingTestEvidence": [
        {
          "testPath": "Tests/CheckoutCoreTests/CheckoutParserTests.swift",
          "kind": "filename-convention",
          "strength": "naming"
        }
      ]
    }
  ],
  "recommended": [
    {
      "id": "Sources/CheckoutCore/CheckoutParser.swift",
      "name": "CheckoutParser",
      "path": "Sources/CheckoutCore/CheckoutParser.swift",
      "kind": "pure-logic",
      "signals": [
        "pure-logic",
        "edge-case-surface",
        "matching-test"
      ],
      "risk": "high",
      "testability": "high",
      "recommendedTestLevel": "unit",
      "riskReductionScore": 9,
      "maintenanceCost": 2,
      "reasons": [
        "Pure transformation logic",
        "edge-case surface",
        "Existing test file detected; review missing edge cases"
      ],
      "existingTestPaths": [
        "Tests/CheckoutCoreTests/CheckoutParserTests.swift"
      ],
      "existingTestEvidence": [
        {
          "testPath": "Tests/CheckoutCoreTests/CheckoutParserTests.swift",
          "kind": "filename-convention",
          "strength": "naming"
        }
      ]
    },
    {
      "id": "Sources/CheckoutCore/PaymentClient.swift",
      "name": "PaymentClient",
      "path": "Sources/CheckoutCore/PaymentClient.swift",
      "kind": "service",
      "signals": [
        "service-boundary",
        "async-or-concurrency"
      ],
      "risk": "high",
      "testability": "medium",
      "recommendedTestLevel": "unit",
      "riskReductionScore": 8,
      "maintenanceCost": 4,
      "reasons": [
        "Service boundary",
        "async or concurrency behavior"
      ],
      "existingTestPaths": []
    }
  ],
  "skipped": [
    {
      "id": "Sources/CheckoutCore/CheckoutView.swift",
      "name": "CheckoutView",
      "path": "Sources/CheckoutCore/CheckoutView.swift",
      "kind": "ui-view",
      "signals": [
        "swiftui-view"
      ],
      "riskReductionScore": 2,
      "maintenanceCost": 5,
      "reason": "SwiftUI views should only get direct tests when the repo already has UI or snapshot conventions.",
      "preferredCoveragePath": "Cover through view model, reducer, service, or UI/snapshot tests when a convention exists."
    },
    {
      "id": "Sources/CheckoutCore/PaymentResponseDTO.swift",
      "name": "PaymentResponseDTO",
      "path": "Sources/CheckoutCore/PaymentResponseDTO.swift",
      "kind": "dto",
      "signals": [
        "dto-only"
      ],
      "riskReductionScore": 2,
      "maintenanceCost": 4,
      "reason": "DTO-only models are usually better covered through decoding, mapper, or boundary tests.",
      "preferredCoveragePath": "Cover through parser, mapper, networking, repository, or route integration tests that consume the model."
    }
  ],
  "risks": [
    "CheckoutParser has pure transformation logic, edge-case surface and needs edge-case review.",
    "PaymentClient has service boundary, async or concurrency behavior and has no matching test file."
  ]
}
